{
  "schema_version": "agent-work-snapshot/v1",
  "snapshot_id": "snap_claude_0001",
  "agent_id": "example-claude-code-agent",
  "host_id": "example-host-a",
  "parent_task_id": "issue:42",
  "observed_at": "2026-01-01T00:10:00Z",
  "source": "file_inbox",
  "status": "blocked",
  "progress": {"total": 4, "completed": 2, "blocked": 1},
  "current_focus": "Review migration notes",
  "blockers": ["Maintainer decision required for compatibility policy"],
  "outputs": ["docs/migration.md"],
  "next_checkpoint_at": "2026-01-01T01:10:00Z",
  "ttl_seconds": 3600
}
