{
  "schema_version": "agent-work-snapshot/v1",
  "snapshot_id": "snap_render_blocked_0001",
  "agent_id": "example-render-agent",
  "host_id": "example-host-a",
  "parent_task_id": "task_render_0001",
  "observed_at": "2026-01-01T01:00:00Z",
  "source": "file_inbox",
  "status": "blocked",
  "progress": {"total": 4, "completed": 2, "blocked": 1},
  "current_focus": "Waiting on decision for `config` vs **settings** format",
  "blockers": ["Needs review of [spec](docs/spec.md) before proceeding"],
  "outputs": ["docs/draft_output.md"],
  "next_checkpoint_at": "2026-01-01T02:00:00Z",
  "ttl_seconds": 1800
}
