{
  "schema_version": "agent-work-snapshot/v1",
  "snapshot_id": "snap_valid_minimal",
  "agent_id": "example-agent",
  "parent_task_id": "task_example_minimal",
  "observed_at": "2026-01-01T00:00:00Z",
  "source": "local_file",
  "status": "queued",
  "progress": {"total": 0, "completed": 0, "blocked": 0},
  "current_focus": null,
  "blockers": [],
  "outputs": [],
  "next_checkpoint_at": null,
  "ttl_seconds": 60
}
