{
  "schema_version": "agent-work-snapshot/v1",
  "snapshot_id": "snap_render_working_0001",
  "agent_id": "example-render-agent",
  "parent_task_id": "task_render_0001",
  "observed_at": "2026-01-01T00:00:00Z",
  "source": "local_file",
  "status": "working",
  "progress": {"total": 4, "completed": 2, "blocked": 0},
  "current_focus": "Implement core logic",
  "blockers": [],
  "outputs": ["src/example.py"],
  "next_checkpoint_at": "2026-01-01T01:00:00Z",
  "ttl_seconds": 3600
}
