{
  "schema_version": "agent-work-snapshot/v1",
  "snapshot_id": "snap_render_abspath_0001",
  "agent_id": "example-render-agent",
  "parent_task_id": "task_render_0001",
  "observed_at": "2026-01-01T00:00:00Z",
  "source": "local_file",
  "status": "working",
  "progress": {"total": 1, "completed": 0, "blocked": 0},
  "current_focus": "Working",
  "blockers": [],
  "outputs": ["/Users/example/project/output.py"],
  "next_checkpoint_at": null,
  "ttl_seconds": 3600
}
