{
  "schema_version": "agent-work-snapshot/v1",
  "snapshot_id": "snap_render_done_0001",
  "agent_id": "example-render-agent",
  "parent_task_id": "task_render_0001",
  "observed_at": "2026-01-01T02:00:00Z",
  "source": "local_file",
  "status": "completed_candidate",
  "progress": {"total": 4, "completed": 4, "blocked": 0},
  "current_focus": null,
  "blockers": [],
  "outputs": ["src/example.py", "tests/test_example.py"],
  "next_checkpoint_at": null,
  "ttl_seconds": 3600
}
